{
  "task_id": "harness-v2-valid-task",
  "title": "Validate HARNESS V2 remaining completion program task contract",
  "workflow": "remaining_completion_program",
  "workflow_stage": "development",
  "source": {
    "basis": [
      "CURRENT.md",
      "control\\approval.md",
      "control\\permission.md",
      "control\\proof.md",
      "control\\lifecycle.md"
    ],
    "current_pointer": "CURRENT.md"
  },
  "approval": {
    "packet": "Approve HARNESS V2 remaining completion program",
    "approved_paths": [
      "AGENTS.md",
      "RULES.md",
      "CURRENT.md",
      "README.md",
      "README.ko.md",
      "LICENSE",
      "RELEASE_NOTES.md",
      ".gitignore",
      ".gitattributes",
      "package.json",
      "pyproject.toml",
      "_build_backend\\harness_backend.py",
      "bin\\harness-v2.js",
      "rules\\workflows.md",
      "control\\source.md",
      "control\\approval.md",
      "control\\permission.md",
      "control\\proof.md",
      "control\\lifecycle.md",
      "records\\README.md",
      "routing\\manifest.md",
      "artifacts\\registry.md",
      "artifacts\\log.md",
      "safety\\regression.md",
      "safety\\improvement.md",
      "release\\transaction.md",
      "contracts\\task.schema.json",
      "contracts\\approval.schema.json",
      "contracts\\permission.schema.json",
      "contracts\\proof.schema.json",
      "contracts\\lifecycle.schema.json",
      "contracts\\artifact.schema.json",
      "templates\\task.json",
      "templates\\gate-manifest.md",
      "templates\\approval-request.md",
      "templates\\proof-report.md",
      "harness_v2\\__init__.py",
      "harness_v2\\__main__.py",
      "harness_v2\\cli.py",
      "harness_v2\\core.py",
      "harness_v2\\verify.py",
      "harness_v2\\doctor.py",
      "harness_v2\\preflight.py",
      "harness_v2\\gate.py",
      "harness_v2\\mcp.py",
      "tests\\test_harness_v2.py",
      "tests\\fixtures\\valid-task.json",
      "tests\\fixtures\\invalid-missing-approval.json"
    ],
    "excluded_side_effects": [
      "npm publish",
      "Python package registry publish",
      "GitHub release creation",
      "release tag creation",
      "dependency install from network",
      "secret access",
      "external network mutation outside allowed git push",
      "remote MCP hosting",
      "MCP client configuration mutation",
      "destructive operation outside generated verification artifacts"
    ]
  },
  "permission": {
    "allowed_side_effects": [
      "local file writes under F:\\Folder\\harness-v2",
      "temporary verification folders under TEMP",
      "python -m compileall harness_v2",
      "python -m unittest discover tests",
      "node bin\\harness-v2.js status --root .",
      "node bin\\harness-v2.js verify tests\\fixtures\\valid-task.json",
      "node bin\\harness-v2.js mcp < JSON-RPC smoke input",
      "node bin\\harness-v2.js gate tests\\fixtures\\valid-task.json --root . --side-effect \"python -m compileall harness_v2\"",
      "node bin\\harness-v2.js doctor --root .",
      "node bin\\harness-v2.js init --root <temporary project>",
      "python -m harness_v2 status --root <repo root>",
      "python -m harness_v2 verify tests\\fixtures\\valid-task.json",
      "python -m harness_v2 mcp < JSON-RPC smoke input",
      "python -m harness_v2 gate tests\\fixtures\\valid-task.json --root . --side-effect \"python -m unittest discover tests\"",
      "python -m harness_v2 doctor --root <repo root>",
      "python -m harness_v2 init --root <temporary project>",
      "python -m harness_v2 verify <temporary project>\\contracts\\harness-task.json",
      "npm pack --dry-run",
      "git add <intended HARNESS V2 product files>",
      "git commit",
      "git push"
    ],
    "denied_side_effects": [
      "npm publish",
      "Python package registry publish",
      "GitHub release creation",
      "release tag creation",
      "dependency install from network",
      "secret access",
      "external network mutation outside allowed git push",
      "remote MCP hosting",
      "MCP client configuration mutation",
      "destructive operation outside generated verification artifacts"
    ]
  },
  "proof": {
    "obligations": [
      "compileall exits 0",
      "unittest exits 0",
      "node wrapper status exits 0",
      "node wrapper verify exits 0",
      "node wrapper mcp smoke exits 0",
      "node wrapper doctor exits 0 with release boundary closed",
      "python status exits 0",
      "python verify exits 0",
      "python mcp smoke exits 0",
      "python doctor exits 0 with release boundary closed",
      "python init creates a valid temporary project harness",
      "node wrapper init creates a valid temporary project harness",
      "npm pack dry-run exits 0 without publishing or generated pycache files",
      "generated AGENTS/RULES/CURRENT bind AI agents without relying on README authority",
      "generated scaffold is not described as automatic enforcement completion",
      "valid fixture accepted",
      "invalid fixture rejected",
      "no npm publish, Python package registry publish, dependency install, secret access, external mutation outside allowed git push, remote MCP hosting, MCP client configuration mutation, release tag creation, GitHub release creation, or destructive operation outside generated verification artifacts"
    ]
  },
  "lifecycle": {
    "current_state": "package_publish_review",
    "target_state": "package_publish_review"
  }
}
